{
  "version": 1,
  "owner": "elemacy",
  "features": [
    {
      "id": "elemacy:condition:archive/author",
      "owner": "elemacy",
      "kind": "condition",
      "identifier": "archive/author",
      "source": "src/Conditions/Mock/AuthorArchive.php",
      "implementation": "placeholder",
      "prerequisites": [],
      "coverage": [],
      "journey": {
        "id": "elemacy:journey:condition:archive/author",
        "status": "pending",
        "profiles": [
          "free-only",
          "free-pro"
        ],
        "expected": [
          "Placeholder remains locked; unavailable saved dependency suspends affected content; Pro restores the same identifier."
        ],
        "reason": "Native authoring journey not implemented; existing runner presence is not evidence of coverage.",
        "follow_up": "automate-release-browser-testing"
      }
    },
    {
      "id": "elemacy:condition:archive/date",
      "owner": "elemacy",
      "kind": "condition",
      "identifier": "archive/date",
      "source": "src/Conditions/Mock/DateArchive.php",
      "implementation": "placeholder",
      "prerequisites": [],
      "coverage": [],
      "journey": {
        "id": "elemacy:journey:condition:archive/date",
        "status": "pending",
        "profiles": [
          "free-only",
          "free-pro"
        ],
        "expected": [
          "Placeholder remains locked; unavailable saved dependency suspends affected content; Pro restores the same identifier."
        ],
        "reason": "Native authoring journey not implemented; existing runner presence is not evidence of coverage.",
        "follow_up": "automate-release-browser-testing"
      }
    },
    {
      "id": "elemacy:condition:archive/post_type",
      "owner": "elemacy",
      "kind": "condition",
      "identifier": "archive/post_type",
      "source": "src/Conditions/Archive/PostType.php",
      "implementation": "real",
      "prerequisites": [],
      "coverage": [
        "elemacy:integration:archive-conditions"
      ],
      "journey": {
        "id": "elemacy:journey:condition:archive/post_type",
        "status": "pending",
        "profiles": [
          "free-only",
          "free-pro"
        ],
        "expected": [
          "Configure through supported UI, save, reopen and verify persisted choices.",
          "Verify the authored output or interaction as a visitor.",
          "Verify applicable invalid, empty and unavailable dependency behavior.",
          "With no post type it is the one \"every archive\" condition (Pro's archive/all was removed)."
        ],
        "reason": "Native authoring journey not implemented; existing runner presence is not evidence of coverage.",
        "follow_up": "automate-release-browser-testing"
      }
    },
    {
      "id": "elemacy:condition:archive/tax/{taxonomy}",
      "owner": "elemacy",
      "kind": "condition",
      "identifier": "archive/tax/{taxonomy}",
      "source": "src/Conditions/Mock/TaxonomyArchive.php",
      "implementation": "placeholder",
      "prerequisites": [],
      "coverage": [],
      "journey": {
        "id": "elemacy:journey:condition:archive/tax/{taxonomy}",
        "status": "pending",
        "profiles": [
          "free-only",
          "free-pro"
        ],
        "expected": [
          "Placeholder remains locked; unavailable saved dependency suspends affected content; Pro restores the same identifier."
        ],
        "reason": "Native authoring journey not implemented; existing runner presence is not evidence of coverage.",
        "follow_up": "automate-release-browser-testing"
      }
    },
    {
      "id": "elemacy:condition:general/blog",
      "owner": "elemacy",
      "kind": "condition",
      "identifier": "general/blog",
      "source": "src/Conditions/Mock/Blog.php",
      "implementation": "placeholder",
      "prerequisites": [],
      "coverage": [],
      "journey": {
        "id": "elemacy:journey:condition:general/blog",
        "status": "pending",
        "profiles": [
          "free-only",
          "free-pro"
        ],
        "expected": [
          "Placeholder remains locked; unavailable saved dependency suspends affected content; Pro restores the same identifier."
        ],
        "reason": "Native authoring journey not implemented; existing runner presence is not evidence of coverage.",
        "follow_up": "automate-release-browser-testing"
      }
    },
    {
      "id": "elemacy:condition:general/entire_site",
      "owner": "elemacy",
      "kind": "condition",
      "identifier": "general/entire_site",
      "source": "src/Conditions/General/EntireSite.php",
      "implementation": "real",
      "prerequisites": [],
      "coverage": [
        "elemacy:integration:template-precedence"
      ],
      "journey": {
        "id": "elemacy:journey:condition:general/entire_site",
        "status": "pending",
        "profiles": [
          "free-only",
          "free-pro"
        ],
        "expected": [
          "Configure through supported UI, save, reopen and verify persisted choices.",
          "Verify the authored output or interaction as a visitor.",
          "Verify applicable invalid, empty and unavailable dependency behavior."
        ],
        "reason": "Native authoring journey not implemented; existing runner presence is not evidence of coverage.",
        "follow_up": "automate-release-browser-testing"
      }
    },
    {
      "id": "elemacy:condition:general/front_page",
      "owner": "elemacy",
      "kind": "condition",
      "identifier": "general/front_page",
      "source": "src/Conditions/Mock/FrontPage.php",
      "implementation": "placeholder",
      "prerequisites": [],
      "coverage": [],
      "journey": {
        "id": "elemacy:journey:condition:general/front_page",
        "status": "pending",
        "profiles": [
          "free-only",
          "free-pro"
        ],
        "expected": [
          "Placeholder remains locked; unavailable saved dependency suspends affected content; Pro restores the same identifier."
        ],
        "reason": "Native authoring journey not implemented; existing runner presence is not evidence of coverage.",
        "follow_up": "automate-release-browser-testing"
      }
    },
    {
      "id": "elemacy:condition:general/not_found",
      "owner": "elemacy",
      "kind": "condition",
      "identifier": "general/not_found",
      "source": "src/Conditions/Mock/NotFound.php",
      "implementation": "placeholder",
      "prerequisites": [],
      "coverage": [],
      "journey": {
        "id": "elemacy:journey:condition:general/not_found",
        "status": "pending",
        "profiles": [
          "free-only",
          "free-pro"
        ],
        "expected": [
          "Placeholder remains locked; unavailable saved dependency suspends affected content; Pro restores the same identifier."
        ],
        "reason": "Native authoring journey not implemented; existing runner presence is not evidence of coverage.",
        "follow_up": "automate-release-browser-testing"
      }
    },
    {
      "id": "elemacy:condition:search/all",
      "owner": "elemacy",
      "kind": "condition",
      "identifier": "search/all",
      "source": "src/Conditions/Search/AllResults.php",
      "implementation": "real",
      "prerequisites": [],
      "coverage": [
        "elemacy:integration:search-template-conditions",
        "elemacy:runner:run"
      ],
      "journey": {
        "id": "elemacy:journey:condition:search/all",
        "status": "pending",
        "profiles": [
          "free-only",
          "free-pro"
        ],
        "expected": [
          "Configure through supported UI, save, reopen and verify persisted choices.",
          "Verify the authored output or interaction as a visitor.",
          "Verify applicable invalid, empty and unavailable dependency behavior."
        ],
        "reason": "The only Search Results condition; offered on Search Results, Header and Footer templates and on popups (finalize-builders-for-release removed Pro's duplicate general/search_results). Authoring a Search template with the condition, the refused blank row, save, reopen and visitor checks pass in the free-only and free-pro profiles (tests/e2e/journeys/search-conditions.spec.mjs, elemacy:journey:condition:search/all); a Header on search pages is covered by tests/integration/search-template-conditions.php. The remaining applicable profiles and branches are pending.",
        "follow_up": "automate-release-browser-testing"
      }
    },
    {
      "id": "elemacy:condition:search/post_type",
      "owner": "elemacy",
      "kind": "condition",
      "identifier": "search/post_type",
      "source": "src/Conditions/Mock/SearchPostType.php",
      "implementation": "placeholder",
      "prerequisites": [],
      "coverage": [
        "elemacy:runner:run",
        "elemacy:integration:search-template-conditions"
      ],
      "journey": {
        "id": "elemacy:journey:condition:search/post_type",
        "status": "pending",
        "profiles": [
          "free-only",
          "free-pro"
        ],
        "expected": [
          "Placeholder remains locked; unavailable saved dependency suspends affected content; Pro restores the same identifier."
        ],
        "reason": "The locked option on a Search template is asserted in the free-only profile (tests/e2e/journeys/search-conditions.spec.mjs, elemacy:journey:condition:search/post_type); suspension of a saved rule without Pro and its restoration are covered by native integration only, not yet by a browser journey.",
        "follow_up": "automate-release-browser-testing"
      }
    },
    {
      "id": "elemacy:condition:singular/by_author",
      "owner": "elemacy",
      "kind": "condition",
      "identifier": "singular/by_author",
      "source": "src/Conditions/Mock/ByAuthor.php",
      "implementation": "placeholder",
      "prerequisites": [],